{"$schema":"http://json-schema.org/draft-07/schema#","$id":"https://agentic-website-studio.local/schemas/pilot-closure.schema.json","type":"object","additionalProperties":false,"required":["schemaVersion","closureId","pilotId","humanDecision","status","historicalGate","scopeBoundary"],"properties":{"schemaVersion":{"const":"1.0.0"},"closureId":{"type":"string","minLength":1},"pilotId":{"const":"wayfinder"},"humanDecision":{"type":"object","additionalProperties":false,"required":["action","recordedAt","statement"],"properties":{"action":{"const":"close_pilot"},"recordedAt":{"type":"string","format":"date"},"statement":{"type":"string","minLength":1}}},"status":{"type":"object","additionalProperties":false,"required":["pilot","releaseReadiness","publicDeployment"],"properties":{"pilot":{"const":"completed_internal_pilot"},"releaseReadiness":{"const":"not_requested"},"publicDeployment":{"const":false}}},"historicalGate":{"type":"object","additionalProperties":false,"required":["path","status","preservedAsUnanswered"],"properties":{"path":{"type":"string","minLength":1},"status":{"const":"pending_human_expansion_replaytest"},"preservedAsUnanswered":{"const":true}}},"scopeBoundary":{"type":"object","additionalProperties":false,"required":["furtherWayfinderImplementation","releaseReadiness","deployment","pilot2Implementation"],"properties":{"furtherWayfinderImplementation":{"const":false},"releaseReadiness":{"const":false},"deployment":{"const":false},"pilot2Implementation":{"const":false}}}}}
