{
  "schemaVersion": "1.0.0",
  "closureId": "pilot_closure_wayfinder_01",
  "pilotId": "wayfinder",
  "humanDecision": {"action":"close_pilot","recordedAt":"2026-09-08","statement":"The current Wayfinder presentation, content, and form are sufficiently satisfactory for its purpose as an Agentic Website Studio example. This completed internal dogfood pilot stops here; effort should move to materially different examples."},
  "status": {"pilot":"completed_internal_pilot","releaseReadiness":"not_requested","publicDeployment":false},
  "historicalGate": {"path":"docs/wayfinder.m43r-human-expansion-replaytest-gate.json","status":"pending_human_expansion_replaytest","preservedAsUnanswered":true},
  "scopeBoundary": {"furtherWayfinderImplementation":false,"releaseReadiness":false,"deployment":false,"pilot2Implementation":false}
}
